comentario;nota;data
Outra visita obrigatória na visita à Brasília, imperdível para apreciação e fotos, mesmo que somente pelo lado externo sem acesso ao interior vale o passeio.;5.0;jan de 2023
14.NOV.2022 - Todo turista que vai a Brasília tem a obrigação de conhecer os três poderes. Infelizmente na data da nossa visita, por medida de segurança ficamos impedidos de conhecer o interior das casas os três poderes, somente pelo lado externo. Como tínhamos agendado previamente uma visita a Câmara dos Deputados, pelo menos tivemos este gostinho de fazer a visita interna . VALEU;5.0;nov de 2022
Visitei a praça alguns dias depois dos atos de vandalismo. Uma tristeza ver um local tão bonito, destruído. De qualquer forma vimos as esculturas externas. Não ficamos muito tempo pois estavam trabalhando para reorganizar o lugar. De qualquer maneira valeu conhecer pela bela arquitetura.;4.0;jan de 2023
havia uma exposição sobre os 200 anos da Independência nos Corredores de acesso ao Congresso - Câmara dos Deputados;5.0;ago de 2022
A praça dos três poderes é outro ponto imperdível na capital federal. Infelizmente não é possível se aproximar do palácio do planalto mas vale muito a pena conhecer.;4.0;ago de 2022
"Praça ampla ladeada pelo Congresso, STF e Palácio do Planalto; é o ponto mais importante da política do país.   Tem alguns monumentos históricos mas deveria estar mais bem cuidada. De qualquer forma vale a visita.";5.0;jun de 2022
A praça foi toda planejada, com muito espaço onde são encontrados quase todos os prédios políticos. Arquitetura variada. Local onde ocorrem as manifestações.;4.0;mai de 2022
Uma praça ampla e vazia. No momento mal cuidada. Mato entre as pedras. Lamentável, aparenta abandono. Falta vida. Frustrante.;3.0;abr de 2022
Decepcionante. O lugar está semManutenção alguma. Estão faltando pedras portuguesas com buracos no chão. Tem mato entre as pedrinhas. O local de turismo está pichado. Nitidamente é o reflexo da falta de diálogo entre os 3 poderes, uma forma de um se isolar do outro através da sujeira. Realmente está muito feio e decepcionante. Em tempo, aquelas barreiras para impedir o público de visitar por fora o palácio do planalto, o STF e oCongresso mostra  como Taos poderes estão longe de povo e como eles estão sendo sustentados pelo seu próprio poder. O Brasil não é uma república de verdade. É muito revelador observar que o Brasil está cheio de príncipes com privilégios pagos com o dinheiro que sai da mesa dos miseráveis.;3.0;ago de 2021
É o centro da República, onde as decisões mais importantes do país e que impactam negativa ou positivamente a vida dos brasileiros são tomadas.;5.0;jul de 2021
Um único local e você verá os principais pontos turísticos da nossa capital federal!  Um combo imperdível!!;5.0;set de 2019
Um dos principais pontos de Brasília. A vista permite ver em 360º arquiteturas que de dão fama à  capital do país.;5.0;jan de 2020
Local de Brasilia com arquitetura moderna, onde JK deixou para o Brasil a nova CapitalBrasilia e tudo de bom;5.0;jun de 2019
Não há como não visitar a praça dos 3 poderes vindo até Brasília, é como não conhecê-la de verdade! Local lindo, as construções são verdadeiros monumentos históricos, tudo é impecável! ;5.0;abr de 2020
Infelizmente só é possível conhecer o lado externo, pois as visitas internas nos palacios estão proibidas. Mesmo assim, rende belas fotos;3.0;fev de 2021
Praça ampla, onde nos oferece a oportunidade de tirarmos boas fotos. Nesta praça há a escultura dos Candangos, nome dado aos portugueses da época, assim como uma gigantesca bandeira hasteada.;4.0;jan de 2021
Talvez o principal atrativo de Brasília, onde ficam localizados os prédios do Supremo, do Congresso e o palácio do presidente;5.0;out de 2020
Ponto turístico muito importante para quem visita Brasília, porém fiquei decepcionada com a falta de cuidado com o local. Piso com muitas pedras soltas, lixo no chão e monumentos sujos. Na minha opinião, o local deveria ser impecável!!!!;3.0;out de 2020
Um ótimo lugar para ir, essencial que alguém que vá a Brasília ir conhecer, é gratuito e tem bastante história, para quem sabe obviamente.;5.0;nov de 2019
E um ponto obrigatorio a ir conhecer quando vai a Brasilia. Da para aproveitar para conhecer outros ponto. E na Pandemia esta bem tranquilo sem muvuca. ;5.0;ago de 2020
Não dá para visitar a capital do país e não vir na Esplanada dos Ministérios, visita obrigatória. Ao visitar a Esplanada, não deixe de almoçar no restaurante da Câmara que fica no último andar do anexo, vale muito a pena!;5.0;mar de 2020
De lá é possível avistar o principal prédio de cada um dos Três Poderes: Palácio do Planalto (Executivo), Congresso Nacional (Legislativo) e Supremo Tribunal Federal (Judiciário). É a praça do povo na Capital Federal. Pela má, conservação do local, pôde-se ter uma ideia que não se dá muita importância ao povo...;3.0;mar de 2020
Um lugar onde num mesmo espaço se concentra tudo ou seja onde se toma todas as decisões independente de qual seja estas decisões para o país, para nossas vidas.Muito espaço para fotos, bem movimentado principalmente durante o dia onde se tem a maior concentração de pessoas / turistas, repórteres além dos que trabalham nos órgão próximos.;5.0;jan de 2020
A praça dos três poderes chama a atenção pelo conjunto arquitetônico suntuoso. Obrigatório para quem visita nossa capital.;4.0;mar de 2019
Espaço amplo, como é comum na cidade. Nada de vegetação. Lugar interessante, mas poderia estar mais bem cuidado.;4.0;jan de 2020
Concentrando os principais prédios da República, além da homenagem aos cidadãos que ergueram a cidade, a Praça dos três Poderes é parada obrigatória.;5.0;jan de 2020
Os monumentos da Praça dos Três Poderes são o Cartão Postal da cidade de Brasília, mas está tão acabadinha que dá dó.;4.0;jan de 2020
Eh bonito ver a praça... Mas na verdade, não tem nada de mais.... talvez quem seja da área do direito, veja através de outra perspectiva. No entanto, vale a pena ver sim.;3.0;jan de 2020
Se nossos deputados e senadores pudessem admirar o eixo monumental e a Praça dos Três Poderes com atenção plena tomariam decisões mais nobres. Veja com seus próprios olhos e verá que Brasília não é corrupta, mas é o palco perfeito para tomada de boas decisões. Inspiração não falta.;5.0;jan de 2020
Vale a pena a visita para conhecer um dos pontos mais importantes do país, tirar fotos e entender um pouco da arquitetura de Brasília.;4.0;dez de 2019
"Pça dos 3 Poderes, detalhes: abriga ainda um Pombal e uma antiga Casa de Chá (o espaço físico, ora funciona, ora não). Falta um ajardinamento estiloso,  poucas muretinhas usadas assentos - Carece também de um iluminação féerica. Comporta totalmente um baita ""upgrade"" na casa de chá: decorações externa e interna - talvez um bistrô ou uma cafeteria estilosa, capaz de atrair os turistas visitantes e mesmo a população de Brasília, inclusive com alguma espaço no teto para observações astronômicas, pois o local às vezes recebe um bom número de observadores astronômicos amadores";4.0;dez de 2019
É bonito para tirar fotos e só. Longe de tudo.nao tem lanche nem opção de descanso por perto. A Não ser que tenha algum evento;3.0;nov de 2019
Você consegue ver como é tudo muito bem planejado. Espaços largos e muita imponência. Merece um tempinho por ali.;4.0;nov de 2019
Apesar de bem planejado, tem nada demais. A arquitetura é  bonita, bem limpa a visão, porém achei meio abandonado.;3.0;dez de 2019
Vale a pena conhecer a praça dos três poderes, é a praça de maior importância do país. Lá você estará de frente para os três poderes do país: legislativo, judiciário e executivo, todos juntos, mas separados pela constituição....Também vai apreciar o melhor da arquitetura moderna.;5.0;out de 2019
Obra fantástica pra quem gosta de Arquitetura a praça e algo a colocar em sua vista a Brasília. Representa nossa democracia brasileira. Seu amplo espaço aberto entre os três edifícios monumentais que representam os três poderes da República: o Palácio do Planalto, o Supremo Tribunal Federal e o Congresso Nacional. Vale a pena visitar. Obs vá de tênis e compre água ;5.0;dez de 2019
Dá para fazer um tour completo por dentro da praça dos três poderes. Pode subir na torre e ter uma linda lista lá de cima. Esta construção representa os poderes legislativo, executivo e judiciário. Lembre-se de colocar no seu roteiro.;5.0;nov de 2019
O local é lindo. Representa a democracia. Os poderes legislativo, executivo e judiciário. Num dia bonito, pode-se tirar fotos lindas lá. Não há como visitar Brasília e não ir ao local. Contudo, é um local descampado, e em um dia quente, com muito sol, não há onde se abrigar. ;4.0;nov de 2019
Conhecer a praça dos 3 poderes é quase que visita obrigatória para quem vai a Brasília pela primeira vez. É interessante, mas não chega a ser um local confortável para pedestres, com poucas árvores e quase nenhum banco para se sentar e apreciar a paisagem.;3.0;set de 2019
A praça dos três poderes é um local bem agradável de se conhecer em Brasilia, onde podemos ver o Palácio do Planalto, o STF e o Congresso Nacional. La podemos ver diversas esculturas, como “Os Candangos”, “A Justiça”, “O Pombal”, o mastro que guarda a bandeira Nacional, a Pira da Pátria, alem do museu Histórico de Brasilia, o CAT (Centro de Atendimento ao Turista). Ultimamente a Setur DF tem utilizado o espaço para promover eventos culturais como ballet, bandas, etc. Vale muito a pena conhecer este local lindíssimo e que faz parte da historia de Brasilia. ;5.0;ago de 2019
É um ponto, mais do que turístico,  de interesse, importância e conhecimento nacional. Considero como parada obrigatória em Brasília. Ir à Brasília, e não passar, pelo menos de carro por lá, é quase como não ter conhecido Brasília 😉A Praça dos Três Poderes é um espaço aberto que compreende os três edifícios monumentais dos mais importantes  poderes da República do Brasil : o Palácio do Planalto, o Supremo Tribunal Federal (STJ) e o Congresso Nacional. Além desses edifícios, podemos ver e admirar a escultura “Os Guerreiros” ou como é popularmente conhecida: “Os Candangos” Também a Pira da Pátria, o Marco Brasília e o gigantesco mastro da Bandeira. Nesta última viagem estivemos na Praça em 2 oportunidades: manhã do evento da troca da Bandeira, momento no qual havia muito movimento. E fim de tarde, bem mais tranquilo e ideal pra realizar boas fotografias. Vale muito a pena visitar e conhecer ;4.0;out de 2019
Fazer esse roteiro em Brasília faz parte. Atenção aos horários que permitem estacionar ali. Estava tendo manifestação e tinha um grupo grande de indígenas. O Bandeirão, os candangos, a justiça cega, tudo que você vê na TV, tem lá ao vivo.;3.0;out de 2019
Simplesmente não tem acessibilidade. Além de não ter guias rebaixadas, o acesso ao Museu Histórico, espaço Lucio Costa, Panteão e o Centro de Atendimento ao turista contam apenas com escadas! Estava com uma bebê no carrinho, e tive que revezar com o meu marido para visitarmos os locais enquanto o outro ficava com a bebê e o carrinho. Se estivesse sozinha, não seria possível. Para cadeirantes, ALGUNS espaços tem a cadeira para escada. Também achei o piso mal conservado. É uma parada “obrigatória” em Brasília, mas saí de lá decepcionada. ;2.0;out de 2019
Área em que se concentram os prédios principais dos Poderes (Judiciário, Executivo e Legislativo), é um cartão postal de Brasília. Há visitas guiadas em algumas atrações e, no sub solo de um memorial, há uma miniatura da cidade.;4.0;dez de 2018
Arquitetura famosa dos idealizadores de Brasília. Area do Plano Piloto próximo do lago Paranoá. Muito bonito o local.;5.0;jun de 2019
A Praça dos Três Poderes é onde reune muitos órgãos do Governo Federal. Ali temos o Palácio do Planalto, o Congresso Nacional e o Senado da República, o STF, a Bandeira, entre outros. Visitação obrigatória para todos que vem a Brasília.;5.0;set de 2019
Local pouco movimentado de pessoas a pé, mal cuidado. Só vale a pena se você é advogado e quer tirar uma foto com a estátua da justiça. Em baixo da praça tem o espaço Lúcio Costa que possui a maquete da cidade de Brasília - não abre às segundas.;4.0;set de 2019
Lugar bonito e agradável que carrega parte da nossa Historia, Aos amantes do Oscar Niemeyer, um excelente lugar para conhecer parte da sua obra;5.0;out de 2018
Ela deveria ser de visita obrigatória pra todo brasileiro. Arquitetura única no mundo. Não deixem de ver a maquete no subsolo. O banheiro tb fica no subsolo.;3.0;jul de 2019
Em um mini micro tour,  tivemos a honra de ver a guarda do governo em uma cerimônia.  Foi emocionante.;4.0;jul de 2019
Lugar bonito com os maiores símbolos de Brasília em um lugar apenas. Aproveite para alugar um patinete ou bicicleta e dar uma volta pelas redondezas. ;5.0;ago de 2019
A praça dos três poderes tem inúmeros monumentos que valem a pena ser visitados, além de estar no núcleo do Congresso, Palácio do Planalto, STJ, próximo a bandeira Nacional. Lá há troca de bandeiras uma vez por mês, um evento imperdível.;5.0;jul de 2019
"Uma praça como esta em qualquer país do mundo seria mais limpa e sem barricadas para proteger os ""deuses"" que se deleitam nos palácios das cercanias.";2.0;jul de 2019
Mais um ponto quase que obrigatório para  quem vai conhecer a Capital do Brasil. Mas nada atrativo a fazer a não ser bater algumas fotos e ir embora. Ali no subsolo (do Espaço Lúcio Costa) tem um banheiro simples mas funcional.;4.0;jul de 2019
O local é um ícone do país, mas na prática, é uma praça de cimento, pouco confortável, com vista para os prédios do STF, Congresso e Palácio do Planalto. Ali também fica o Panteão e o Espaço Lúcio Costa, que tem algum interesse.Chama a atenção o fato de um ícone do país não ser um lugar arborizado, que atraia as pessoas, mas um lugar seco, onde pouco se tem pra fazer além de bater meia-dúzia de fotos.Porém, para quem vai a Brasília a passeio, é ponto obrigatório de parada. Não faz sentido não conhecer.;3.0;jul de 2019
Lugar emblemático que traduz o governo do nosso país. Fiquei impressionado com a limpeza e organização desse lugar.;5.0;jun de 2019
Enfrente ao Palácio do Alvorada , presidente. Bem enorme a praça.  Bem monitorada.Toda essa região, é bem tranquila. ;4.0;jul de 2019
É bacana, mas nada que chame muito a atenção ou que te faça ficar horas admirando seus momumentos. Vale a pena atravessá-la e fazer fotos da bandeira nacional e dos palácios que a cercam.;4.0;nov de 2018
Vale a pena conhecer a capital do Brasil...muitos lugares estavam fechados ou em reforma, a maioria dos lugares tem rampas e acessível para cadeirantes.;4.0;jun de 2019
"Visita obrigatória em Brasília; símbolo nacional, que representa os três poderes: Congresso, STF e Palácio do Planalto";3.0;mai de 2019
É muito bom conhecer nosso país. Brasília é uma cidade incrível e a Praça dos Três Poderes é o coração do Brasil. Arquitetura linda.;4.0;jun de 2019
Lugar que nos remete à nação, às nossas responsabilidades, ao que não devemos mais deixar acontecer.;4.0;jun de 2019
Muito bacana estar nessa praça diante dos três poderes que governam e decidem os rumos do nosso país! Muito espaço livre para caminhar e tirar ótimas fotos.;4.0;jun de 2019
"Praça ampla, bem cuidada, abriga um dos mais importantes pontos de turismo obrigatório em Brasilia. Neste espaço estão os prédios que representam os Três Poderes da República: Palácio do Planalto (Executivo), Congresso Nacional (Legislativo) e o Supremo Tribunal Federal (Judiciário).A arquitetura tem a marca de Oscar Niemeyer.Apesar de ser cahamada de ""praça"", é um local totalmente aberto sem nehuma árvore ou vegetação. Apenas algumas palmeiras imperial, espelhos de água e esculturas complementam a urbanizaçào local.Saber que neste espaço estão nossos representantes e, decisões importantes são discutidas e definidas alí, é de arrepiarVale a visita, especialmente aos finais de semana onde é fácil o acesso e local para estacionar.";4.0;jun de 2019
É sem sombra de duvidas o lugar mais lindos da cidade, ao lado do congresso nacional, do mastro com nossa bandeira. lugar único . ;5.0;mai de 2019
Local diferente para a maioria dos brasileiros, principalmente para os que vêm conhecer Brasília. Arquitetura moderna, onde está o centro do Governo. Os três poderes estão nessa Praça. A visitação aos Palácios é possível, mas necessita de verificar os horários e se há necessidade de visitar. Um local único e que vale a pena a visita, além de ser seguro.;5.0;jun de 2019
Ponto a ser visitado de forma rápida, mas não chega a ser imponente, muitos vendedores ambulantes circulando;3.0;jun de 2019
Que ligar sem graça de visitar... E com tanto espaço sobrando, todos são proibidos pra estacionar... Affff Ficam lá as viaturas do Detran, desocupados, prontos pra multar que se prestar Air visitar essas feiuras de monumentos e ainda corre o risco de serem multados... Tá repreendido... Nunca mais!!!!;1.0;jun de 2019
Conhecer Brasília e conhecer a obra de Oscar Niemeyer e JK. Prédios belíssimos e imponentes que mereciam ter servidores mais sérios e mais comprometidos com o Brasil e não com o poder e o dinheiro.;4.0;mai de 2019
Se chega a praça na expectativa de que vai encontrar aquela multidão, mas na verdade em um dia de semana, sómente turistas passam pelo local;4.0;mai de 2019
Sempre um prazer visitar Brasília e desta vez estive num dia de troca da bandeira. Evento popular com bonita cerimônia. A estrutura arquitetônica de Brasília mesmo show. ;5.0;jun de 2019
Centro político nacional do Brasil, interessante ao visitar a região conhecê-lo, interessante uma reforma nos prédios, são nossa vitrine ;4.0;jun de 2019
Aos desavisados, a Praça parece tão somente um descampado pavimentado ... mas se olhar melhor, lá tem 2 museus, dois monumentos, um pombal, 3 ícones da arquitetura de Brasília, um Pavilhão, vista para a maior bandeira hasteada do mundo.Se quiser levar milho, os pombos agradecem.;4.0;jun de 2019
Lugar interessante para se constatar a genialidade de Oscar Niemeyer e Lúcio Costa ao observar suas obras dispostas num traçado Urbano moderno. Na praça é realizada, todo primeiro domingo do mês a troca da Bandeira Nacional, um espetáculo cívico.;3.0;jun de 2019
O local é lindo, pena que as pessoas que grande parte das pessoas que fazem uso daquele ambiente são impróprios para está ali. Os funcionários em dia de visitas são muito educados e contam bem a historia de cada peça e ambiente q estão por ali. ;4.0;jun de 2019
Na verdade não tem muita coisa na praça em si, mas é um bom lugar para comprar souvenir. O que mais chama a atenção é a simbologia, e possui também uma maquete da cidade.;4.0;mai de 2019
Praça que une as construções mais famosas de Brasília.. além disso tem esculturas, a maquete da cidade, informações turísticas é um museu.Bem interessante ;5.0;mai de 2019
Olha aqui uma das poucas coisas que gostei na arquitetura de Brasília...Levem guarda-chuva, faça chuva ou sol, pois apesar dessa famosa escultura, lá é só concreto a céu aberto mesmo...;3.0;mai de 2019
Um lugar incrível que sempre quis conhecer. Durante o dia tem vendedores distribuídos por toda a praça. É possível tirar fotos dos principais órgãos do país.É bom evitar o período noturno, pois não tem muito movimento no lugar. Mas é lindo para tirar uma foto do Congresso Nacional com as luzes.;5.0;set de 2018
A Praça dos Três Poderes tem uma simbologia própria: ela reflete o centro do poder do nosso país. Não possui árvores nem estruturas que pudessem  atrapalhar a visão de quem visita este local, para um fim único: de lá, de qualquer ponto onde você estiver (estando na praça) o turista consegue vislumbrar os três monunentos erguidos para perpetuar os três poderes que emanam da Capital Federal: Poder Judiciário (Supremo Tribunal Federal), o Poder Executivo (Palácio do Planalto) e o Poder Legislativo (Congresso Nacional). Monumentos onde todas as decisões políticas que envolvem o futuro do país e de seus habitantes são tomadas. O subsolo onde tem uma enorme maquete do Plano Piloto, estava fechada para visitação. O projeto inicial feito por Oscar Niemeyer foi alterado e atualmente há algumas árvores plantadas em alguns locais e foi construída uma ciclovia. Adorei conhecer e recomendo.  ;5.0;abr de 2019
Uma praça que mais parece uma galeria de arte a céu aberto! Adoramos passear por lá, tinha pouca gente e estava muito limpa!;5.0;abr de 2019
Local importante para todos nós.  Devemos ir conhecer. Nela vemos todos os prédios grandiosos da nossa capital. Imprescindível!;4.0;mai de 2019
Falta um pouco de cuidado e limpeza com o local. Existem muitos ambulantes na área vendendo lembranças da cidade (mais baratos do que na igrejinha).;3.0;abr de 2019
"Estar na Praça dos Três Poderes é se sentir no centro do poder do nosso país, literalmente falando! Judiciário, Executivo e Legislativo, independentes e harmônicos, hipoteticamente, claro! E no meio deles todos, os famosos candangos! Conhecer nossa capital e chegar perto desses ""monumentos"" que só vemos pela TV é uma experiência pela qual todos os brasileiros deveriam passar. ";5.0;dez de 2018
Troca da bandeira que é realizada no primeiro domingo do mês ... passeio legal em família... com execução do hino Nacional, hino da bandeira e salva de canhões ;5.0;abr de 2019
Bem localizada. Nada muito atrativo. O mais legal é ver os três poderes realmente bem próximos. Legal. ;3.0;mar de 2019
"Construída para ser a Capital do Brasil, totalmente planejada - exceto invasões e assentos, Brasília é uma inspiração para modelo de cidades planejadas, mas que, infelizmente sucumbiu a vários problemas, tais como: Super população, pobreza, abandono estrutural, engarrafamentos, e a pior de todas: a corrupção, que rouba as verbas públicas, trazendo sofrimento para os mais pobres, e luxo para os Pets dos ricos, aliás, milionários que povoam as margens do Lago Paranoá - Gilmar Mendes, Ministro do STF é um destes ""ilustres"" moradores....";5.0;jan de 2019
Um dos pontos turísticos da cidade de Brasília, praça onde reúne de cada um dos lados o Judiciário, Legislativo e Executivo.;3.0;jan de 2019
Excelente ponto turístico de Brasília! Além de estar bem no centro da capital do pais, você vai estar exatamente no centro do poder, entre a o Judiciário, legislativo e executivo... sem contar que vai poder descer no subsolo da praça e conhecer uma maquete gigante de todo plano piloto! é muito lega!;5.0;dez de 2018
A limpeza do local deixa muito a desejar. Um local tão importante para a cidade merecia melhor cuidado;3.0;jan de 2019
Fui a Praça dos Três Poderes e no mesmo dia conheci aí STF e o congresso nacional! Recomendo! É o centro político brasileiro! Recomendo fazer suas visitas guiadas a cada um dos três poderes!;5.0;abr de 2019
Infelizmente, o cartão postal da cidade, ou nossa sala de visitas da cidade está assim, ABANDONADO. Minha casa jamais esteve desta forma....;1.0;fev de 2019
O título é mais uma crítica à situação de infraestrutura do local que uma crítica política. Sou defensor da democracia e defendo o equilíbrio entre os três poderes. Aquele espaço me dá vergonha. Está jogado às traças, as pedras portuguesas depredadas literalmente, sem sinalização, atrações fechadas, sem guias. E além do mais com cercas em volta dos prédios pois receiam as manifestações justas de indignação popular. Uma vergonha para o turismo cívico. Mas, tem de ser visitada;3.0;abr de 2019
O lugar é bonito, alguns artesãos da cidade vendem lembrancinhas. Fica próximo ao Palácio do Planalto e do Supremo Tribunal Federal.;5.0;mar de 2019
A Praça dos 3 Poderes é moderna, ampla, com visual futurista!Adoro a forma do Congresso, da Palácio do Planalto e o Palácio da Justiça, o conjunto é único, maravilhoso!;5.0;mar de 2019
"Trata-se de uma visita de conhecimento, que é o significado dos tres personagens ali representados nas tres estatuas; alem disso, temos uma visão dos tres prédios que representam os tres poderes - legislativo, judiciário e executivo.";3.0;dez de 2018
Conhecer a cidade de onde partem as principais decisões que comandam um país, onde são intensificadas nosssas atenções.;5.0;jul de 2018
Praça aonde se encontra os três poderes. Próximo do Parthenon, e da bandeira do Brasil. Há também um museu com uma maquete que representa o plano piloto. E neste local também há um centro de atendimento ao turista.;4.0;mar de 2019
Tem seu charme e importância por ser o centro dos poderes do país,tem monumentos interessantes,o acesso ao centro Lucio Costa,mas a praça em si, está com vários pontos irregulares no calçamento,como pedras soltas, mato por falta de conservação, algo imperdoável pela sua história;3.0;mar de 2019
A praça dos três poderes é o símbolo da democracia brasileira. Parada obrigatória pra quem vai a Brasília, rende belas fotos e uma boa aula de história. Recomendo a visita ao STF, lá o pessoal do cerimonial conta um pouco da história da praça e de locais interessantes que ali estão, como o pombal construído por Oscar Niemeyer a pedido da esposa do então presidente Jânio Quadros.;5.0;mar de 2019
