comentario;nota;data
Ela é imponente, pois a arquitetura fala por si. Expressa um ar majestoso. É legal conhecer e dar muitos clics pra registrar.;5.0;out de 2013
Olhar os prédios com compõe os 3 poderes da República, dá uma ideia da importância dessa praça. Com visual ainda moderno, é muito procurado para fotografias, principalmente à noite.;4.0;jul de 2014
Foi o máximo chegar a praça é ver tanta gente protestando neste caso foi a Conferência Internacional de Mulheres aquilo é lindo , cheio de gente de todas as partes em protestos divesos , ou simplesmente para apreciar a  bela Arquitetura de Brasília.;4.0;out de 2013
Marco arquitetônico nacional, Oscar Niemeyer em sua melhor fase, impressiona pela beleza e pela importancia. Todo o contexto, cheio de prédios governamentais e ministérios confere ainda mais valor á obra. Magnifico.;5.0;set de 2014
histórico. praça dos Três Poderes da pra tirar umas fotos legais. é um dos pontos turísticos de Brasília, e por lá já passaram grandes nomes da história do Brasil. não tem como ir a Brasília e não passar na praça.;4.0;jun de 2014
Sempre tem um Show ali, ou de Jazz ou Blues , quando não tem nada, ainda assim temos um belo lugar para refletir, também um dos mais belos pontos turísticos de Brasilia.;5.0;ago de 2014
A cerimônia de troca da bandeira acontece todo primeiro domingo do mês.Realmente é muito interessante e bem patriótica.Quando fui houve até tiros de canhão..  ;4.0;abr de 2014
De um lado, o STF. De outro, o Palácio do Planalto. De outro, o Congresso Nacional. Judiciário, Executivo e Legislativo se encontram ali. Não pode dizer que conheceu Brasilia sem ter visitado.;5.0;jun de 2014
Muito lindo os prédios localizados na praça dos três poderes, tirei muitas fotos do local. Claro que minha preferência é pelo prédio do STF, só que o mais bonito é o congresso nacional.;4.0;jan de 2014
Brasília tem disso, de cada ângulo você vê algo lindo, Nesta praça é assim, da Pira se tem uma panorâmica linda, da frente de cada Palácio tem outras perspectivas incríveis. Pena que o povinho que manda lá não é tão bonito assim (os políticos, a bem dizer!);5.0;out de 2013
praca bacana de ser visitar, faz parte do roteiro turistico de brasilia. porem é muito quente, faltam arvores;3.0;ago de 2014
Pelo simbolismo do lugar para toda a nação, é meio descuidado. Impossível de se estacionar. Não há onde se proteger do forte sol (ou de eventual chuva). Comprar água? Só se der sorte de alguém estiver vendendo por perto. Falta de lixeiras. Falta de banheiros. Não é muito seguro (princialmente de noite). E os prédios ficam todos entrincheirados por grades, ou seja, nem o visual para a foto salva 100%.;3.0;out de 2013
O calor é forte, mas um passeio pela praça é indispensável. De um lado o palácio do planalto, ao centro o Congresso e do outro o STF. O lugar tem uma aura poderosa.;4.0;ago de 2014
Vale a pena pela arquitetura de Lucio Costa e Nyemaier. O clima estava muito seco e o gramado descuidado.;5.0;ago de 2014
Está um pouco descuidado e com a presença de ambulantes,o que penso por em risco os poderosos que estão por ali.;3.0;ago de 2014
Haver um local onde reflete os rumos do país é com certeza muito interressante. Vale a pena buscar um pouco da hist´ria da cidade e co local para entender a harmonia da praça. No primeiro domingo de cada , a tradicional cerimônia de substituição da Bandeira Nacional é um bom programa de família e civismo.;4.0;jun de 2014
A praça está diante dos três palácios que abrigam as sedes dos três poderes da República, o Executivo, o Legislativo e o Judiciário. Ali estão também o Panteão, com o livro em que estão inscritos os nomes dos heróis nacionais, e o Espaço Lúcio Costa, com uma interessante maquete da cidade de Brasília, que ajuda os visitantes a entender como está disposto o plano urbanístico da capital brasileira.;4.0;ago de 2014
Ideal para aqueles que desejam conhecer a arquitetura e a história de Brasília. Conta com uma incrivel maquete da cidade e também algumas esculturas. ;4.0;jul de 2014
gostei de tudo lugar muito bonito e agradavel,e miuto visitado.quando resolver realizar essa visita va com bastante tempo;5.0;jul de 2014
Estar no Centro da Praça dos Três Poderes e imaginar que ali, está a importância politica no meu país foi uma experiência emocionante. A pé podemos chegar aos lugares mais importantes, apenas atravessando a rua. Segurança excelente. Vale a pena.;5.0;ago de 2014
Interessante o local, conhecendo onde ocorre o comando do Brasil. Como é uma área do cerrado o sol é muito forte e o tempo é bem seco, para se prevenir leve um protetor solar, boné e uma garrafa com água, na praça não sombra para se refugiar.;5.0;jan de 2014
Muito impressionante a arquitetura inovadora e arrojada de Niemeyer, diferente de todas as outras capitais.;5.0;jun de 2014
Se vier a Brasilia e não conhecer a praça dos tres poderes com certeza você não conheceu Brasilia. É emblematico e faz parte de nossa historia.;4.0;ago de 2014
O Congresso Nacional é de uma arquitetura maravilhosa do saudoso Oscar Niemeyer.Poder entrar em seus salões com monitor e conhecer um pouco mais sobre a cidade de Brasília e sua construção.No cair da noite podemos tirar fotos belíssimas.;4.0;ago de 2014
Adoro esse cantinho, aonde podemos ver toda a arquitetura de Brasília, o Palácio do Planalto, o Stf, o Congresso Nacional, o Palácio dp Planalto, o Panteão e a Bandeira do Brasil em todo seu explendor;5.0;jun de 2014
A Praça dos Três Poderes fica no coração de Brasília, na Esplanada dos Ministérios.  Local que representa bem a arquitetura de Niemeyer.  O local é bem servido de ônibus, a menos que você queira ir para a Asa Norte - há poucas linhas para essa região.;4.0;jun de 2014
Onde se reunem os tres poderes e as pessoas que decidem o futuro do Brasil. É um lugar que sempre ficará para a história. ;3.0;ago de 2014
Vale o conjunto da esplanada, a praça é bem bonita e bem cuidada, com a homenagem a JK. Passeio interessante.;4.0;jan de 2014
Ao redor da praça estão quase todos os pontos turísticos de Brasilia, vale a pena ir uma vez para conhecer, tirar fotos. ;4.0;ago de 2014
Se for durante o dia verá as belezas arquitetônicas, mas durante a noite, com a iluminação que recebem as sedes dos três poderes da República, a praça assume mais beleza, sem esquecer do significado com que foi projetada. Além disso, mensalmente há a troca do Bandeirão e invariavelmente, nos fins de semana, show gratuitos muito, muito bons!;5.0;ago de 2014
moro na cidade, mas levei meu sobrinho para conhecer e tirar fotos. o local é agradável, encontramos muitos turistas pois é um ponto turístico de Brasília.;4.0;jun de 2014
Como tudo em Brasília, não pode deixar de ser visitado.Passear a pé em Brasilia é muito bom . Não tinha Brasília como um destino de passeio , mudei de idéia,pretendo voltar.;5.0;jul de 2014
Muito bonito, o passeio não estaria completo sem a visita a Praça dos Três Poderes. Vale a pena conhecer!;5.0;out de 2013
Brasília uma cidade planejada cheia de palácios arrojados, é munito bonita e o lugar mais impotante que todo mundo quer estar chama-se Praça dos Três Poderes.Sim é a praça dos poderosos, é la que fica o poder máximo do Brsil ocupada pelos deputados, senadores e o presidente da república. Tudo muito grandioso, palco das grandes manifestações populares. Palácio0 da justiça, monumento a Tancredo Neves em forma de uma pomba.Um matro acima de todos com uma bandeira sempre asteada, que significa a soberania do Brasil constituonalmente, nunca deve ser arreada.Tem muito mais inclusive um espelho d´agua com jardins magníficos.;5.0;set de 2013
A praça dos três poderes é muito bonita e representativa. O equilíbrio entre os Poderes Judiciário, Legislativo e Executivo. Recomendo muito a visita. ;4.0;out de 2013
A praça dos Tres Poderes é um lugar muito bonito para visitação. Eh onde se localiza o panteão, o bandeirão e o pombal. De la podemos visitar o STJ, o Congresso e o Palacio. ;5.0;dez de 2013
Muito interessante com a arquitetura emblemática de seu criador, Niemeyer. Muito bonito de se ver.É o clássico passeio em Brasília.;4.0;jul de 2014
Poucos locais podem oferecer diferentes monumentos, nesse local se poder apreciar as arquiteturas monumentais desta bela cidade.;5.0;ago de 2014
Imperdível. É onde o visitante e o morador de Brasília sentem a esfera de simbologia entre os 3 Poderes da União. Tem uns pombos nojentos pras crianças alimentarem por lá. A foto fica bacana!;5.0;abr de 2014
Ponto turístico muito bonito ,pois mostra o centro do poder de nosso país. Porém deixa a desejar nos cuidados para com os turistas. Mensagens que não são traduzidas para o inglês, falta de cuidado com os monumentos, não tem guia e as pessoas que tem para pedir informações não sabem explicar direito. Falta de pessoas treinadas para receber os turistas.;3.0;set de 2013
Aquele que vem a Brasilia tem com parada obrigatória a parca dos três poderes. De la o viajante tem uma visão do palácio do planalto com sua imponente rampa, do STF guardião da nos constituição e do congresso nacional com sua cúpulas invertidas. o local e seguros e bem informado. Para fotos vale a pena.;4.0;mai de 2014
"Obra fantástica de Oscar Niemayer, sua localização central, na ""cabine"" do avião que personifica o Plano Piloto e Brasília, capital nacional, reúne os três poderes que deveriam representar, no mais alto grau de respeito a coisa pública, a vontade do povo brasileiro. Sempre bem limpa, e policiada, é um local que deve ser visitado, por todos aqueles que são brasileiros de coração...";4.0;abr de 2014
A praça é muito bonita, local ótimo para tirar fotos, parada obrigatória para quem gosta de arquitetura.;5.0;ago de 2014
Ao ir à Praça dos Três Poderes pode-se conhecer ao mesmo tempo os poderes executivo (Palácio do Planalto), Legislativo (Congresso Nacional) e Judiciário (Supremo Tribunal Federal).;4.0;ago de 2014
Não tem como visitar Brasília e não dar uma passada na praça dos três poderes pra tirar umas fotos, onde fica o centro político de todo o nosso Brasil!;5.0;fev de 2014
bom para passear e a noite namorar, conta com boa segurança e várias esculturas para se encantar, final do mes conta com a troca da bandeira;5.0;mar de 2014
A Praça dos 3 poderes é um lugar para se visitar com calma e um certo tempo. Vc pode optar pela visita ao Palácio do Planalto e ao Congresso Nacional, para isso dê uma olhada nos sites dos órgãos e saiba mais sobre as visitações guiadas. Atrás do Congresso está o espelho d`água e uma alameda de coqueiros, o visitante também poderá ver o mastro da bandeira e o Panteão, bem como a escultura dos Candangos. Vale à pena deixar o carro no estacionamento da Câmara dos Deputados e seguir a pé. Todos os prédios estão bem próximos.;4.0;ago de 2014
O local é muito bonito e interessante, para tirar fotos lindas. No dia em que visitamos tinham umas estruturas de um show de Jazz que aconteceu no dia anterior, o lugar esta com cheiro não muito agradável de urina. Mas valeu o passeio.;4.0;ago de 2014
É basicamente o centro da cidade onde tudo acontece, rodeado pelos ministérios ao fundo o palácio do planalto e ao centro um enorme gramado onde acontecem shows, missas, encontros políticos, partidas de vôlei de praia, aterrizar de asa delta e até reuniões de jovens que marcam uma simples partida de quadribol. Assistir o por do sol é o máximo.;5.0;dez de 2013
Um excelente lugar para ir e tirar umas fotos. As fotos no por do Sol são com certeza um show a parte, pois é possível enquadrar o sol entre as torres do Congresso.Poderia ser mais limpa e iluminada, mas vale a visita.;3.0;mai de 2014
O centro do poder, lugar histórico e agradável, um lugar muito bem planejado, ambiente aberto amplo e belo;4.0;ago de 2014
além da arquitetura dos palácios do planalto, do congresso e o supremo vale pela simbologia e ideia de uma praça com os três poderes soberanos do país. todo brasileiro deveria ir pelo menos uma vez na vida;5.0;fev de 2014
Também um ponto turístico de muito valor histórico e que tem que ser visitado e admirado com orgulho. Pois faz parte da nossa cultura.;4.0;jun de 2014
Muito bonitas as esculturas e a praça é gostosa para se passear com as crianças. Cada vez que vemos pela TV minha filha comenta que fomos até lá.;5.0;nov de 2013
Que obra de arquitetura fabulosa. É de emocionar a leveza e a harmonia das estruturas quando vistas de longe. Realmente é um cartão postal que o brasileiro deve se orgulhas de mostrar no exterior. Quanto aos frequentadores dos mesmos, fomos nós que os escolhemos e não podemos reclamar. ;5.0;ago de 2014
Praça muito agradável bem no centro do poder do país. Lugar com muitos bons o que traz um ar agradável, além de alguns monumentos. vale a pena conhecer.;5.0;out de 2013
Lindo local, mas estava tendo um show e com isto estava cheia de cercas e com muito odor de urina, mas vale a pena conhecer, principalmente para tirar lindas fotos de todos so prédios e monumentos.;4.0;ago de 2014
O local é interessante de de conhecer. Tem uma arquitetura bonita e é um espaço bem amplo. Quando eu fui estava  um pouco sujo, mas nada exorbitante. No final das contas, trata-se de um lugar para se fazer uma visita rápida quando se passeia pela esplanada.;3.0;jan de 2014
O local é de visita obrigatória para quem passa pela cidade. Para quem tem máquina que tire foto panorâmica, ficam lindas nesse local.;5.0;jun de 2014
Vale a visita para apreciar a beleza dos prédios e sentir a boa sensação de estar onde as decisões mais importantes do pais são tomadas.;5.0;ago de 2014
Local onde se pode ver a cúpula dos três poderes da república. A dica é tirar fotos a noite, para se aproveitar a linda iluminação do local.;4.0;ago de 2014
Brasília em si já é um cartão-postal, mas esse lugar é lindo, marcante, mágico e ótimo para tirar fotos e bem amplo.;5.0;jul de 2014
Muito lindo o campo gramado, à noite tem luzes o suficiente para boas fotos. O pessoal da segurança é muito profissional e cordial.;5.0;ago de 2014
Local amplo que permite tirar boas fotos das sedes do judiciário e executivo, além da parte de trás do Congresso Nacional. Ali fica o Espaço Lúcio Costa com a maquete da cidade.;4.0;ago de 2014
a Praça dos tres Poderes em Brasilia é um grande exemplo da magnifica criatividade de Oscar Niemeyer e da ousadia de JK que estava nao somente presente na aprovaçao de todos os monumentos de Brasilia como dava sua palavra final neste processo de criaçao desta cidade que tem uma beleza sem igual no mundo.Grandes espaços,grandes obras ,grandes criaçoes nos fazem perder o .Nesta época a humidade muito baixa faz uma pouco mal e a respiraçao fica dificil  entretanto o que mais impressiona é o gramado que se estende por toda Brasilia embora no momento a chuva faz falta .;5.0;ago de 2014
É simplesmente uma obra-prima da arte moderna feita em concreto. Na minha opinião, um do pontos urbanos mais bonitos do mundo para se visitar. Além de um majestoso símbolo materializado da teoria da tripartição de poderes.;5.0;ago de 2014
A Praça dos Três Pideres é o elo de ligação entre o Supremo Tribunal Federal, o Palácio do Planalto e o Congresso Nacional. Lá também ficam o panteão da pátria e espaço Lúcio Costa;4.0;ago de 2014
Fica junto a outros pontos turísticos  que são imperdíveis.Tudo amplo, fácil de visitar.Vale a pena.Tem ambulantes que complicam o cenário.;5.0;ago de 2014
um passeio onde o turista estara entre os 3 poderes da republica. o stf, o congresso nacional e o palacio do planalto. otima opçço para visitar com a familia;4.0;ago de 2014
Me emocionei ao ver a Bandeira , é impressionante o sentimento que nos dá . é lindo , não deixem de ir.;5.0;out de 2013
É impossível estar na Praça dos 3 Poderes em Brasília e não ficar imaginando o que passava na mente criativa de Niemeyer, quando bolou esses 3 edifícios-monumentos, que representam os Poderes da República: Executivo, Legislativo e Judiciário. Pensando bem, acredito que é uma ampliação moderna da concepção antiga, pela qual as cidades mantinham e muitas ainda mantêm, na Praça principal, os prédios da Prefeitura, do Fórum e da Câmara, além da Igreja Matriz. Brasília, apesar dos pesares levados por alguns homens que lá chegaram, ainda é futurista.;5.0;ago de 2014
É parada obrigatória para contemplar os prédios públicos onde funcionam os três poderes da república. Há abulantes vendendo lembranças e oferecendo passeios, mas nada que chegue a perturbar. Nos dias de semana é comum que existam grupos manifestando-se contra isso ou aquilo, praticamente faz parte do cenário, mas por ser muito grande, sempre se tem a impressão que são poucos.;5.0;fev de 2014
fui com meus filhos, o que já valeu a visita. mas diga-se de passagem que só podemos olhar pelo lado de fora... há seguranças por todos os lados.;5.0;ago de 2014
Trata-se de um  local turístico para visitação de no máximo 30 minutos.Um amplo espaço no meio da praça que não tem nexo nenhum, falta muito verde nos principais locais da praça. O que viria bem a calhar em um local com umidade relativa tão baixa. Local para ser visitado somente 1 vez.Nada agradável ;2.0;ago de 2014
Local simbólico, que nos finais de semana fica lotado de turistas, mas é bem Niemeyer, muito concreto e muito espaço...Não é um lugar bonito, mas é passagem obrigatória, pois integra os três poderes da República, O STF (judiciário), o Congresso Nacional (legislativo) e o Palácio do Planalto (executivo).;3.0;jul de 2014
Pra quem nunca visitou Brasília é ponto turístico obrigatório. Vale a pena conhecer os Três poderes e o congresso Nacional;4.0;jan de 2014
Estar no centro do poder da República e muito importante para qualquer brasileiro e faz parte do nosso aprendizado sobre a história contemporânea.;4.0;set de 2013
Um grande espaço que integra o Congresso Nacional, Palácio do Planalto e Supremo tribunal Federal.niemeyer projetou este local de modo a Unir os 3 poderes da Republica: Legislativo, Executivo e Judiciário.e de modo que um prédio tem visão total dos outros 2 poderes;5.0;jun de 2014
Vale visitar e algumas fotos. Não era tão bonito que parece, más vale visitar. Talvez ajudar á entender um pouco espíritos das coisas. Espaçoso más sol forte e ardente. Use óculos e protetor solar. Pois SOL de Brasilia é BRAVO.;5.0;ago de 2014
Achei muito legal, ótimo para tirar fotos tem lugares bonitos, pela noite e mais bonito, mas tem partes escuras.;5.0;abr de 2014
Local interessante para passear e conhecer um pouco da história de Brasília. Muitas opções de passeio e para conhecimento histórico.;5.0;ago de 2014
Cartão postal de Brasilia, visita obrigatória bem no centro do poder entre judiciário, executivo e legislativo.;4.0;jul de 2014
trata se de um dos pontos turisticos mais importantes da capital porem nao tem muito a oferecer . é apenas uma praça com um monumento de onde se ve os edificios do legislativo judiaciario . vale uma foto;3.0;jun de 2014
Ponto turístico obrigatório, da onde se observa a sede dos três Poderes: Palácio do Planalto, Congresso Nacional e STF. Interessante observar que o espaço Lúcio Costa e o Panteão da Pátria estão abertos à visitação depois de anos fechados.;5.0;ago de 2014
Ótimo local para passear com família, amigos. Tem muita história a ser contada, sem contar a beleza arquitetônica dos palácios. Um lugar que não pode deixar de ser visitado, mesmo por aqueles que moram em Brasília.;4.0;dez de 2013
A praça é bem ampla, ótima para passeio com crianças, muita usada para protestos. Tem também algumas estatuas, boas para tirar fotos como lembrança da praça.;3.0;ago de 2014
Em Brasília, normalmente as vistas externas são melhores do que as internas. Aqui se tem o principal disso, vistas externas de alguns dos principais monumentos da cidade. Muitas fotos boas.;4.0;ago de 2014
Ir a Brasília e não conhecer não existe. Local muito bonito e de fácil acesso... adoramos a visita. perto do hotel que nos hospedamos, mas mesmo assim é de fácil acesso;5.0;jul de 2014
Também faz parte do conjunto de monumentos e prédios do Plano Piloto. Brasilia está cheia de monumentos e belezas na arquitetura.;5.0;set de 2013
Praça grande, os prédios políticos tem horários específicos para visitação interna. Alguns ambulantes vendendo água e artesanatos. Alguns moradores de rua ao redor. Excelente para registar. ;3.0;jun de 2014
Para ser um ponto tão importante no cenário político do Brasil deixa muito a desejar... mato aparente, buracos... enfim: retrata a consideração dos políticos para com nosso país;3.0;abr de 2014
Fiquei bastante emocionado em conhecer este local. É uma viagem em uma história muito recente e rica do nosso país. ;5.0;ago de 2014
Para todo brasileiro, trata-se de um ponto turístico da cidade imperdível, concentrando a vista e acesso para o Supremo Tribunal Federal, Palácio do Planalto e Congresso Nacional (na verdade fica atrás do Congresso), além do Espaço Cultural Lúcio Costa, que possui uma maquete de Brasília, e o Panteão da Pátria.;5.0;ago de 2014
É super legal estar na capital do país e perceber todo o simbolismo que existe entre a arquitetura da praça, seus prédios e o equilíbrio (que deveria haver) entre os três poderes! É possível fazer uma visita guiada gratuita ao Congresso Nacional e ao Supremo Tribunal Federal. É uma emoção estar lá! ;4.0;jun de 2014
O que dizer este lugar, é imensurável a sua força, a única coisa que posso dizer é que ali mostra o quão grande, forte e soberano é o nosso País.O ruim de lá todo mundo já sabe, senão, te digo os maus políticos.  ;5.0;out de 2013
O lugar é muito bonito e bem zelado. Pena que quando vemos a sede dos Poderes lembramos de todas as mazelas que são produzidas lá dentro e que muito nos atinge.;4.0;jul de 2014
Deixando as questões políticas de lado, esse local emana e demanda respeito. Além de ser a sede dos 3 poderes do país, a beleza dos prédios, dos monumentos e das atrações encanta e hipnotiza. Conhecer a história e as motivações que estão por trás de cada projeto e cada construção também nos faz respeitar ainda mais esse local.Na visita, não deixe de visitar o Espaço Lúcio Costa, que fica no subsolo da praça e o Museu da Cidade, o prédio onde se encontra uma grande cabeça do ex-presidente Juscelino.No espaço Lúcio Costa há uma maquete do Plano Piloto de Brasília. Lá também há banheiros disponíveis para o público.;5.0;ago de 2014
Mais do que a arquitetura, o planejamento e tudo mais, está o que ela representa. O mais legal é que sentimos algo diferente ao ver aquilo tudo, um sentimento que não sei descrever, não é bem nacionalismo ou não sei dizer o quê, mas com certeza muito diferente.;4.0;jul de 2014
Da Praça é possivel ver a sede do Congresso, do governo federal e do Judiciário do nosso país. Leve alguma proteção para o sol, pois a praça não tem qualquer ponto de sombra.;3.0;jul de 2014
É um lugar muito interessante de se conhecer. A praça é muito grande e conta com monumentos muito bonitos. É possível fazer uma visita guiada em cada um dos prédios dos Poderes da República.;4.0;nov de 2013
"Os ministérios ficam dos dois lados de uma grande avenida chamada Esplanada dos Ministérios. Destacam-se os bonitos prédios do Ministério da Justiça e o Itamarati, que tem arquitetura arrojada, diferente dos ministérios ""caixa de sapato"". Antes dos ministérios, fica a Catedral e, no final, ficam os prédios do Congresso Nacional e, de um lado o Supremo Tribunal Federal e, do outro, o Palácio do Planalto. É visita obrigatória. Se pretender caminhar ou pedalar por ali, traga um chapéu e protetor solar. Em Brasilia, o que parece perto é beeemmm longe!";5.0;ago de 2014
Interessante, mas o passeio por lá é bem rápido. Um espaço aberto onde é possível ver os três edifícios monumentais que representam os poderes da República.;4.0;abr de 2014
A praça dos Três Poderes do nosso país é muito bonita, só precisa de uma melhor conservação e de políticos corretos.;4.0;jun de 2014
Bom para conhecer, vale a pena na ida a Brasília conhecer, pena que lembramos logo dos políticos, mas a beleza compensa.;4.0;set de 2013
Adorei estar no local aonde se concentra efetivamente os órgãos que governam o nosso país. Apesar de mal cuidado e o acesso ao local ser péssimo (Brasília tem o pior transporte público que eu já vi na minha vida), vale a pena a visita.;5.0;mai de 2014
praça onde o povo gosta de visitar, entretanto poderia ter algo pra acomodar o povo. Um imenso local vazio entre os três prédios que representam os três poderes do Brasil. ;4.0;jul de 2014
local bom para uma volta ao final da tarde. Possue as esculturas que representam boa parte da historia da cidade;4.0;ago de 2014
Brasilia é singular, moro aqui há muitos anos, gosto muito de viajar, no entanto, adoro voltar para Brasília!;5.0;mai de 2014
"Seria um local turístico e cívico muito interessante, mas falta segurança e limpeza. Está ""abandonado"" pelo poder público.";3.0;ago de 2014
 Com arquitetura moderna e diferente.Interessante porque podemos tirar fotos dos 3 monumentos em uma unica parada, alem do Congresso Nacional.;5.0;jun de 2014
