comentario;nota;data
Excelente ponto turistico da capital, parada obrigatória para turistas. Há um espaço no subsolo onde é possível visualizar uma maquete da cidade e conhecer um pouco da sua história. O ponto falho é que falta ajuda ao visitante. Zero receptividade. Da praça é possivel visualizar as imponentes arquiteturas e fazer excelentes fotos.;4.0;jul de 2015
A praça, em si, é irrelevante. O grande atrativo é o Panteão da Pátria e da Liberdade Tancredo Neves, que cheira a mofo e não trem graça. ;2.0;ago de 2015
Parece que estou navegando pelos livros de história e visitar um monumento tão importante e tão vislumbrante para mim foi um êxtase.;5.0;ago de 2015
Visita obrigatória para quem passa por Brasília. O visual a partir da praça vale muito a pena, apesar de não ser um local lindo, exatamente.;5.0;ago de 2015
Independentemente de ser cartão postal de Brasília e visitação obrigatória aos turistas, a praça, em si, não é maravilhosa, pelo contrário, diria que sua ambientação é simples em relação ao seu entorno. O piso de pedras portuguesas apresenta bastantes buracos, demonstrando falta de manutenção. O visual a partir da praça, esse sim, impressiona, pois dali temos visão de várias obras de Niemeyer. Vale a pena!;3.0;ago de 2015
Espaço amplo que conta conta com um Museu (que supostamente ninguém imagine que seja um), estátuas de simbologia importante, dois palácios e o Congresso Nacional. Dica: prefira visitar o local em um período de pouco sol, pois faz muito calor por lá. Não deixe de curtir o Panteão da Pátria e a Pira. A vista de lá é simplesmente incrível.;4.0;set de 2014
Quem nunca foi a Brasília deve visitar a Praça dos Três Poderes, no Eixo Monumental. Aqui se sente porque esta cidade foi criada.;4.0;ago de 2015
Local procurado por Turistas para fotos, onde se localiza a Camera dos Deputados e o Senado Federal, Tribunal Pontal da Bandeira a Maior do Brasil Hasteada só indo para sentir e conhecer.;5.0;ago de 2015
Não tem como ir à capital federal e não visitar este marco da política. Facil acesso, símbolo maior de Brasília com arquitetura imponente.;3.0;ago de 2015
Passeio imperdível para quem vai à Brasília. São tantos prédios importantes, arquitetura espetacular. Vale a pena tirar foto da bandeira do Brasil, é linda e enorme.;5.0;ago de 2015
Muito bacana de ver e fotografar, quem visitar Brasilia mesmo que a trabalho tem que conhecer e registrar, super tranquilo e seguro mesmo a noite..;3.0;ago de 2015
Espaço aberto, onde estão abrigados os monumentos arquitetônicos e as sedes dos três  poderes do Brasil,  Executivo (Palácio do Planalto),  Legislativo (Congresso Nacional) e  Judiciário (STF). Todos os monumentos estão abertos à visitação guiada. Vale a pena ir no final de tarde para contemplar um belo por do sol da Praça.;5.0;ago de 2015
Belíssima área onde podemos dizer, fica localizado o coração do Brasil, mas que para minha decepção, se encontra em pleno processo de decadência com o mato tomando conta, o piso, feito com pedras portuguesas, se soltando, pichações, lixo de ambulantes espalhados no chão. Em resumo, lugar histórico,ainda muito bonito, porém decadente.Lamentável.;4.0;ago de 2015
Incrível construírem uma cidade inteira para o centro do poder. Impressiona pela beleza e grandiosidade. ;5.0;ago de 2015
Simplesmente harmônica! Nesse ponto, o visitante fica a poucos metros do Congresso  Nacional, do Palácio do Planalto e do STF! Ótimas fotografias podem ser tiradas, como esta que publicarei.;4.0;ago de 2015
"Fui a Brasilia sem muitas expectativas quanto aos pontos turísticos, mas chegando a capital do nosso país, tive uma bela surpresa.  Realmente emocionante estar onde tudo em nossas vidas é decidido. Arquitetura magnifica, tudo lá eh amplo, desde as construções até as vias expressas. Emocionei-me com a Praça dos Três Poderes,  muito linda,  o Eixo Monumental e a famosa escultura dos ""Candangos"". Oscar Niemeyer foi realmente um visionário. ";5.0;ago de 2015
e um espetáculo, apesar de órgãos públicos, as visitas são constantes, dia inteiro, a câmera, senado federal, a presidência da republica tudo muito diferente, do que se costuma ver, e sem falar na parte interior, e lindo, vale apena conhecer bem de perto;5.0;ago de 2015
Não é uma praça muito bonita, mas não só tem manifestações, como também três museus razoáveis, com entradas gratuitas. Há uma parada de ônibus ao lado.;3.0;ago de 2015
vale a pena conhecer. em um dia se dá para percorrer toda a esplanada e praça dos três poderes. Melhor, de graca!!;4.0;jul de 2015
Um ótimo jeito de sentir-se no clima de Brasília. é possível ver as principais construções dos 3 poderes e ainda um charmoso pombal. Cuidado com os pombos, muito próximo ao pombal há piolhos. ;5.0;ago de 2015
Lindo designer da praça dos tres poderes, vale a pena visitar pois é muito perto dos ministerios e da casa da alvorada. Dá para conhecer um monte de atrativos tudo o mesmo lugar.;3.0;set de 2014
O conjunto da obra que forma a Praça dos Três Poderes é uma beleza ímpar. Impossível ir a Brasília e não dar ao menos uma pequena passeada pela praça dos Três Poderes.;5.0;jul de 2015
A visita à Praça em si é muito legal pois a arquitetura é linda! O passeio nos túneis do tempo nos prédios da Câmara e Senado são imperdíveis! Uma verdadeira aula de História! Fique atento pois durante a semana as visitas aos prédios só podem ser feitos de calça comprida.;4.0;jul de 2015
Local onde concentra os três poderes do Brasil, com ótima visão para o Congresso Nacional, Palácio do Planalto e Supremo Tribunal Federal.;4.0;fev de 2015
Um dos pontos turísticos mais visitados em Brasília, onde são realizadas grandes decisões políticas do país, arquiteturas modernas desenhadas pelas mãos de Oscar Niemeyer.;5.0;jul de 2015
Não dá para conhecer Brasília sem conhecer a praça dos três poderes. É símbolo,da cidade e palco de muitas manifestações.;5.0;jul de 2015
Muito bonita a arquitetura do local, local amplo, limpo e organizado. Brasília é uma cidade muito bonita;4.0;ago de 2015
Expoente da arquitetura de Oscar Niemeyer, daqui se vê a Brasília vista por ele e Lúcio Costa, seus idealizadores. Imperdível!;5.0;ago de 2015
Projetado com a mais alta tecnologia, Oscar Niemeyer  com certeza irá fazer muita falta, outro igual ale será dificil, parabéns pelo lindo lugar.;5.0;ago de 2015
Este ano, estive lá pra levar uns amigos que moram em Vitória - ES para conhecer. Senti falta dos patos que nadavam no espelho d'água. Não entrei, a visitação se restringiu à parte externa.;3.0;jul de 2015
A visita é interessante.Local bem aberto, use protetor.Não é bem cuidado.Mas tem coisas interessantes para ver.;3.0;ago de 2015
Um sonho realizado nesta viagem....pudemos conhecer um pouco mais da nossa Histria. Um local com uma imponência que ao meu ver se torna desnecessária, justamente pq somos brasileiros e lutamos por um lugar melhor.;5.0;set de 2014
Acho extremamente desconfortável a praça: excesso de luz, sol, vento. Mas é linda, linda, linda. Não recomendo ir no horário de pico do sol. E leve garrafa de água sempre. ;5.0;dez de 2014
"muito agradável o passeio para visitar e olhar de perto estas maravilhas da arquitetura brasiliense ; todo muito organizado e bonito";5.0;set de 2014
A praça é linda, a arquitetura é incrível, vale muito a pena conhecer. O único problema é banheiro e bebedouro, senti falta.;4.0;set de 2014
Para quem quer conhecer Brasilia, esse é um dos pontos mais importantes da visita. Praça onde reúne os Três Poderes: Executivo, Judiciário e Legislativo, cada um deles representados por obras Arquitetônicas do Oscar Niemeyer.;4.0;set de 2014
Se não tivessem os ambulantes na praça, com certeza ficaria mais bonita a paisagem. Tinha escultura sendo vendida por R$ 60!Descendo umas escadas há uma maquete da cidade, vale muito a pena dar uma olhada.;4.0;ago de 2015
Passeio imperdível de Brasília. Com certeza a área mais bonita de Brasília (no quesito arquitetura). É o local, mundialmente, famoso, onde se concentram a maior parte dos monumentos do Distrito Federal, tais como a Catedral, o Museu da República, o Congresso Nacional, o Palácio do Planalto, o Itamarati, o Palácio da Justiça, o Supremo Tribunal Federal, etc. Para quem tem disposição vale um longo passeio à pé. Para quem está de carro, vale uma esticada ao Palácio da Alvorada, que está bem perto.;5.0;ago de 2015
Imperdível!Vale muito a pena visitar e conhecer melhor como tudo funciona em Brasília.Local agradável para passar um tempo.;5.0;ago de 2015
como não se deixar contaminar pelo imaginário do que acontece por trás da arquitetura dos três poderes? mas vá e se delicie na arquitetura e na arte.;5.0;set de 2014
Interessante o formato de triângulo entre as construções dos poderes da República. Local amplo, palco de debates e manifestações que mudaram a história do país.;5.0;ago de 2015
Turismo civico de Brasilia. Vale a pena visitar quando for passar um  periodo do dia na parte central de Brasilia. ;3.0;jul de 2015
É muito legal ver de perto os famosos prédios que vemos na TV, nos jornais. É interessante estar perto de onde tantas decisões importantes são tomadas.;4.0;jan de 2015
Lembra as reportagens dos telejornais falando de política? É igualzinho! Emblemático! Todo mundo tem que ir.;3.0;ago de 2015
Próximo ao congresso nacional. Unifica os três poderes da nação em um único local. Local de fácil acesso.;4.0;mai de 2015
Visitei a Praça dos Três Poderes com amigos, uma vez à noite, de carro, e outra de dia. Tem uma visão abrangente com os principais prédios que detêm o poder no Brasil. Muito interessante, sobretudo quando vemos nos noticiários as muitas emoções geradas pelos fatos ocorridos no interior daqueles vetustos edifícios.;4.0;ago de 2015
A praça dos 3 poderes é muito bonita e abriga a sede dos 3 poderes do Brasil (Judiciário, Legislativo e Executivo).A praça dos 3 poderes é um dos maiores símbolos brasileiros e é facilmente reconhecível por todos que a veem.Uma visita a Brasília não está completa se você não vier aqui.;4.0;ago de 2015
Este local e seus anexos são de grande importância para os conhecimentos políticos do nosso país. Eu indico que a visita seja feita por algum guia que possa lhes apresentar e acrescentar conhecimento político às famílias brasileiras! Ainda aproveitem para tirar fotos e apreciarem as lindas obras no local.;5.0;out de 2014
A praça dos três poderes é um ótimo passeio pra turistas e moradores. além dos monumentos, contam um pouco da história de Brasília. Não deixe de visitar o espaço Lúcio Costa, onde tem uma maquete do plano piloto.;5.0;dez de 2014
"Vale pela curiosidade de conhecer onde se localizam os edifícios dos ""03 poderes da nação"", não há nada de muito especial e exercitar algum patriotismo.  ";3.0;jul de 2015
Estávamos passeando pela esplanada e a praça dos três poderes e nos deparamos com um tur gratuito dentro do congresso.Visitamos o salão negro, verde com seus azulejos e jardins muito bem cuidados, salão azul, o senado e a assembléia.Confesso que achei o local bem menos do que eu imaginava! Foi muito legal! ;4.0;jul de 2015
Lugar obrigatório para conhecer se for à Brasília. Bela arquitetura, e simbolismo. Vale a pena fazer a visita guiada ao Congresso.;4.0;jul de 2015
Muito interessante! Aconselho a esquecer um pouco da política decepcionante e curtir a arquitetura e toda a história que ronda o cenário!;5.0;jul de 2015
O Eixo Central de Brasília é uma obra de arte plena. A Praça dos Três Poderes é um caso típico desta obra.;4.0;jul de 2015
É a nossa história de 60 pra cá, vale muito a pena o passeio guiado, tanto na Câmara quanto no Senado, ambos trazem muita informação, mas o Senado ainda explica o funcionamento da casa, todo o processa de proposições e votações.;5.0;jun de 2015
seria maravilhoso observar a beleza de sua arquitetura, cheia de significado e simbolismo sem se chatear com o descaso e o desrespeito que os ocupantes de seus palácios tratam o povo brasileiro... mas não consegui = (;4.0;ago de 2015
Ir à Brasília e não conhecer a Praça dos três Poderes e como ir à Paris e não conhecer a torre Eiffel, vale cada momento e não só a praça mas tudo ao redor vale a pena!;4.0;ago de 2015
Para quem vem conhecer a cidade, ou mesmo para os moradores que ainda não pararam para estar na Praça e admirar os prédios públicos a sua volta, o enorme mastro com sua imponente bandeira de nosso país, baixa um certo espírito de civilidade que não temos visto neste momento e nos faz pensar que ainda vale apena ser Brasileiro.;4.0;jul de 2015
"Dizer que o ""coração"" de Brasília é uma obra de arte é pouco. A Praça dos Três Poderes é um grande monumento a céu aberto. O conjunto arquitetônico impressiona pela magnitude das construções e pela harmonia entre elas. Palco de grandes manifestações democráticas brasileiras, tornou-se ponto obrigatório para os turistas e residentes, que podem viver um pouco do clima cívico do Centro do Poder.";5.0;set de 2014
A Praça dos Três Poderes é um ponto turístico obrigatório para quem vai a Brasilia, lá em volta estão todos os prédio do governo federal, por isso precisa reserva em dia inteiro para visitar todos os prédio que tem ali em volta.;5.0;jul de 2015
Lugar histórico de Brasília, onde você vislumbra o Congresso nacional e palácio do planalto e a Supremo Tribunal Federal. Passa a sensação da amplitude de Brasília. ;4.0;jul de 2015
Vale o passeio para admirar a arte de Oscar Niemeyer e também por ser monumento da capital do nosso país.;5.0;mai de 2015
Vale a pena conhecer o Centro do puder do nosso país. É algo que temos de nós exalta pelo feito realizado por nosso povo forte. ;4.0;ago de 2015
É uma verdadeira obra de arte... local muito interessante e bonito, apesar de morar em bsb não tinha parado para visitar e não me arrependi e fiquei me perguntando o porque de não ter feito isso antes. A vista com nossa bandeira no fundo é imponente.;5.0;abr de 2015
Passo por ela todos os dias pois trabalho no Ministerio Da Justiça , e sempre fico impressionada com a arte e a  beleza que as esculturas possuem .;5.0;ago de 2015
Ponto turístico em Brasília - Distrito Federal, escultura bem bonita, fica na Praça dos Três Poderes. Gostamos.;4.0;out de 2014
O cerimonial, como todos devem saber, ocorre todo primeiro domingo do mês, cada vez com uma das forças armadas fazendo a troca. O momento é solene, bonito e tocante. O momento em que os canhões disparam no meio do hino nacional é emocionante, fiquei até tremendo. Pra ser melhor podiam ter mais áreas cobertas e um som um pouco mais alto. Recomendo!;4.0;ago de 2015
É um local muito interessante e bonito, que sempre é visto pela televisão. Quando se está no local existe uma atração especial por ser brasileiro, principalmente quando se olha para a Bandeira Nacional.;5.0;jul de 2015
Aqui está reunido o centro do poder legislativo, executivo e judiciário. Excelente opção de lazer, além de conhecer o funcionamento destes órgãos. Leve sua água e lanches, lá é tudo muito caro. Vir em Brasília e não conhecer a Praça dos Três Poderes e como não vir, rss...;4.0;mai de 2015
"Amplo espaço entre os grandiosos prédios do Executivo, Legislativo e Judiciário. Falta mais verde e paisagismo, talvez prejudicado pelo clima de seca. Destaque para a escultura em bronze ""OsCandangos"" e o ritual da troca de guarda no Palácio do Planalto.";4.0;jul de 2015
Vale a pena pela monumentalidade do conjunto dos edifícios públicos, mas as distâncias são grandes para andar a pe'. E, não esqueçamos, Brasília não foi feita para pedestres: em geral, não há calçadas e as  travessias das avenidas é perigosa.;3.0;jul de 2015
Muito bom local para compreender a arquitetura da capital federal e, principalmente, o que significam os três poderes, algo que nos soa tão etéreo na escola...Amplo, belo e significativo!!!;4.0;ago de 2014
É um lugar perfeito para quem ainda não conhece a capital e deseja saber um pouco mais sobre.Todos tem que um conhecer dia conhecer esses cartões postais, são imperdíveis.;4.0;jun de 2015
Nesta praça, o turista pode ir de um palácio ao outro à pé, apreciando as obras de Niemeyer, e tirando milhares de fotos. Com o clima agradável de Brasília, isto é muito fácil. ;5.0;jun de 2015
Arquitetura linda, o passeio guiado por dentro do Palácio do Planalto foi muito legal, bem emocionante, com obras de arte lindissimas.;4.0;fev de 2015
Praça muito ampla, que interliga os três poderes do nosso pais, tudo bem planejado, vale a pena conhecer...;4.0;jan de 2015
Maravlhoso. Fui na época da copa, tinha bastante gente, fiz um passeio inesquecível por todo espaço que representa  cada um dos brasileiros. achei tudo muito limpo e organizado, lindo e pra quem tem preguiça de andar não vá kkk, se caminha bastante;5.0;ago de 2014
A Praça dos Três Poderes é um dos melhores pontos turísticos de Brasília porque fica no coração político da cidade, entre o Supremo Tribunal Federal, Congresso Nacional e Palácio do Planalto.Evite ir às segundas-feiras, pois neste dia alguns monumentos estão fechados.;4.0;jul de 2015
Vale a pena conhecer um pouco da historia do nosso pais, local com bela arquitetura, porem tem regras, como dias para adentrar ao predio;4.0;jun de 2015
Must go em Brasília! Todos têm que conhecer, apesar das mazelas de nossos políticos... Oscar Niemeyer é um gênio e ninguém pode negar! ;5.0;jul de 2015
A praça dos Três Poderes é outro lugar histórico de Brasília que vale a pena conferir, apesar de eu esperar um pouco mais deste local.;4.0;dez de 2014
O local é surpreendente, quando vc consegue ver o tamanho que a obra de Niemeyer tem, que é absurdamente interessante.;5.0;mai de 2015
Não deixe de visitar a praça dos três poderes e tirar ótimas fotos, se for a Brasília visite-a, a maioria das sedes são abertas a visita, eu fui em um final de semana e pude visitar praticamente tudo.;4.0;jul de 2015
O que dizer de um lugar onde estão reunidos os três poderes que govesnam nosso país? Lindo. Os prédios, a arquitetura, a diposição dos prédios. Fiquei encantada. Vale muito  pena conhecer.;5.0;dez de 2014
É simbólico, mas deveria ter mais conteúdo para visitantes sem guia e deveria falar mais da junção dos poderes.;2.0;jul de 2015
A praça é muito ampla e congrega os edifícios-sede dos poderes da República: Palácio do Planalto, Congresso Nacional e Supremo Tribunal Federal. A partir da praça também é possível acessar o Panteão da Pátria e da Liberdade Tancredo Neves. Vale pela belíssima arquitetura, mas fora os prédios não há muito o que se fazer ou se ver.;3.0;jun de 2015
É interessante observar a arquitetura pensada para a harmonia dos três poderes. Vale a visita tanto da praça quando do congresso, do planalto e do supremo.;4.0;jun de 2015
"A praça, que fica no extremo sul do eixo monumental,  é, na verdade, o amplo espaço entre os edifícios-sede dos três poderes da República: o Palácio do Planalto, o Congresso Nacional e o Supremo Tribunal Federal. O projeto urbanístico é de Lúcio Costa, e as construções, projetos de Niemeyer. Na ""praça"", ficam a escultura dos dois candangos (que se chama ""oficialmente"" Os Guerreiros); o mastro da Bandeira; o Museu Histórico de Brasília, com a cabeça e a célebre frase de JK alusiva à futura capital e ao futuro do país na fachada; o Panteão da Pátria; a escultura da Justiça; a Pira da Pátria. Enfim, local de visita obrigatória para quem quer fazer o roteiro cívico da capital.";5.0;out de 2014
A praça, em si, não possui nada de especial. O destaque é poder apreciar, do mesmo plano, os prédios do Congresso, do STF e o Palácio do Planalto. Local de importância histórica para nosso país.;5.0;jul de 2015
Para os visitantes de brasilia, conhecer a praça dos tres poderes é legal para aprender um pouco da historia do pais. Vale a pena levar um guia e passaer por esta zona com linda arquitetura e paisagens. ;3.0;jul de 2015
A praça em si não é tão imponente, nem tão grande (como o Zócalo mexicano), mas é o centro dos 3 poderes da república, e possui várias esculturas e monumentos homenageando a nova capital. Em seu centro abriga uma grande bandeira brasileira. Pode-se reservar uma manhã para fazer os passeios da esplanada: Catedral, Itamarati, Congresso Nacional, STF, Praça dos 3 poderes e Palácio do Planalto;5.0;jul de 2015
Espaço onde se sente a força do poder do Estado, lugar de visita obrigatória para todo aquele que vota, deveria ser...;4.0;jul de 2015
Muitas fotos, lugar lindo, o céu se encaixa perfeitamente na paisagem. Vão no pôr-do-sol do dia 21 de abril, quando ele se põe exatamente ENTRE as torres do Congresso, rendendo ótimas fotos. Há muitos museus ali, documentando muito bem a história da fundação de Brasília. Para arquitetos é um prato cheio. Niemeyer viverá para sempre através da sua obra.;5.0;jan de 2015
Ponto obrigatório em Brasília para observar a arquitetura do lugar. Fica no eixo monumental, próximo de outros atrativos. Sempre tem imprensa por ali..;4.0;jul de 2015
"Achei que o lado externo dos prédios, por representarem a sede dos Poderes da República precisaria de um pouco mais de cuidado. O ""lago"" na frente do Congresso está muito sujo. Infelizmente até pelo seu local de trabalho nossos políticos têm certo descaso.";4.0;jul de 2015
no meio da praça só se tem sorvete e pipoca, não tem nenhuma outra opção de alimentação nos horários que ocorre a visitação como alguma feira ;2.0;jul de 2015
Oxe, considero que seja o ponto mais importante da visitação. Congresso, STF, e Palácio do Planalto e os monumentos lá. Tem que visitar e tirar muita foto.;5.0;jul de 2015
Um dos símbolos de Brasília, a Praça dos Três Poderes é pobre de atrações, não oferece uma alternativa digna de lanches e ainda os visitantes convivem com os malditos pombos - que são na verdade ratos que voam.;3.0;mai de 2015
Eu sempre visitei e levo as pessoas para visitar. É um tipo de turismo cívico bacana. Antigamente era permitido subir perto das cúpulas, o que é proibido hoje. A visita no interior vale a pena e aos fins de semana, além da galeria pode-se entrar dentro dos plenários da Câmara e do Senado.;4.0;mai de 2015
A gente se sente quase como um grão de areia tamanha a magestade das edificações e a beleza da arquitetura dos prédios.Mesmo tendo visto diversas fotos, nada se compara a emoção de estar naquele gramdado com ipês floridos e cercada de obras de arte.;5.0;jul de 2015
É um local que vale a pena para vc visualizar, de um lugar só, o Congresso Nacional, o STF e o Palácio do Planalto. Dá pra tirar algumas fotos legais. Mas lá não tem sombra, passe muito protetor solar antes de ir para lá! ;3.0;jul de 2015
É um monumento de 100 metros de altura, localizado na Praça dos Três Poderes, no topo do qual se encontra hasteada, permanentemente,  a bandeira nacional.. Segundo o Livro Guinness de  Recordes, esta é a segunda maior bandeira hasteada do mundo, com 286 metros quadrados.É substituída no primeiro domingo de cada mês em cerimônia solene.;4.0;jul de 2015
Todos que vão a Brasília devem visitar essa Praça. pois ela é um grande símbolo em nosso país. Quando visitei senti falta de placas com mais detalhes sobre o que se vê por ali, mas amei estar lá!;4.0;jun de 2015
Problemas políticos à parte, a Praça dos Três Poderes é um patrimônio nosso e é muito bonito. Explore seus 4 cantos e veja os prédios em ângulos diferentes. O lugar é amplo e você terá espaço para apreciar os prédios de arquitetura perfeita. É bonito em qualquer horário do dia, mas em especial no final da tarde.;4.0;ago de 2014
Centro do poder, lugar com arquitetura diferenciada, calmo, energia na arte, uma história a ser formada por você! ;5.0;jul de 2015
Vale apena conhecer, lugar muito bonito, um pouco de história com modernidade, aproveite pra mandar uma cartão postal para um amigo.;4.0;nov de 2014
A praça em si não tem nada de especial. Mas é o local que concentra o congresso nacional, o supremo tribunal e o palácio da alvorada. Tem ainda o panteão em homenagem oa Tancredo.;4.0;jul de 2015
Por incrível que pareça fui a noite e não estava iluminada, nem deu para tirar foto. Aconselho ir de dia, pois é muito bonito a construção/arquitetura. Não achei lugar para estacionar.;3.0;jul de 2015
Na Praça dos Três Poderes encontramos o STF, o Palácio do Planalto, o Museu da Cidade, o Congresso Nacional, o Panteão Tancredo Neves, o Pavilhão Nacional e o espaço Lúcio Costa. Vale a pena o passeio.;5.0;jul de 2015
Tudo excelente, um local sensacional para ser fotografado. Veja, também, o Palácio onde ficam as autoridades do governo. Local para passar no mínimo umas duas horas contemplando as beleza de Brasília.;5.0;mai de 2015
A praça dos três poderes é um local histórico. Todo primeiro domingo do mês há a troca de bandeira, muito bacana. É um local obrigatório para quem visita Brasília.;4.0;ago de 2014
A praça é linda e única, vale muito a pena conhecer! Um dos principais pontos da cidade... Recomendo! ;5.0;ago de 2014
É literalmente o que quer dizer: em cada lado da praça há uma sede dos três poderes. Se todos estiverem com tour no mesmo dia, vale a pena emendar tudo de uma vez. Também há alguns museus por lá, na própria praça.;5.0;jul de 2015
